{
  "schemaVersion": 2,
  "contentRevision": "ws-content-r2.1",
  "domain": "entity-actions",
  "records": [
    {
      "id": "ACT-EN-D1-01",
      "sourceDocumentId": "ENEMY-ACTION-LIST-001",
      "enabled": true,
      "ownerId": "EN-D1-01",
      "kind": "ENEMY_ACTION_BUNDLE",
      "actions": [
        {
          "id": "ED10-HUNGRY-CLAW",
          "name": "ED10-HUNGRY-CLAW",
          "profileId": "EAP-CHASER",
          "telegraphTicks": 9,
          "startupTicks": 4,
          "activeTicks": 4,
          "recoveryTicks": 10,
          "cooldownTicks": 40,
          "cooldownMode": "TICKS",
          "cooldownTrigger": "",
          "range": 3.2,
          "targetPolicy": "NEAREST_ALIVE_PLAYER",
          "damage": 80.0,
          "damageSpec": "80",
          "penetration": 0.0,
          "penetrationSpec": "0",
          "breakDamage": 8.0,
          "breakDamageSpec": "8",
          "statusId": "NONE",
          "statusStacksSpec": "0",
          "statusDurationTicksSpec": "0",
          "effectOpcode": "MELEE_ARC",
          "effectParameters": "angle=85",
          "childEntityIds": [],
          "childEntitySource": "",
          "tags": [
            "MELEE",
            "LIGHT"
          ],
          "responseTags": [
            "DODGE",
            "GUARD",
            "PARRY",
            "DISTANCE"
          ]
        }
      ],
      "stateMachine": [
        "READY",
        "TELEGRAPH",
        "STARTUP",
        "ACTIVE",
        "RECOVERY"
      ],
      "raw": [
        "EN-D1-01",
        "굶주린 배회자",
        "좀비",
        "CHASER·1",
        "300/25",
        "할퀴기 80",
        "없음",
        "1"
      ]
    },
    {
      "id": "ACT-EN-D1-02",
      "sourceDocumentId": "ENEMY-ACTION-LIST-001",
      "enabled": true,
      "ownerId": "EN-D1-02",
      "kind": "ENEMY_ACTION_BUNDLE",
      "actions": [
        {
          "id": "ED10-FLANK-LEAP",
          "name": "ED10-FLANK-LEAP",
          "profileId": "EAP-FLANKER",
          "telegraphTicks": 13,
          "startupTicks": 4,
          "activeTicks": 4,
          "recoveryTicks": 10,
          "cooldownTicks": 70,
          "cooldownMode": "TICKS",
          "cooldownTrigger": "",
          "range": 7.0,
          "targetPolicy": "LOWEST_RECENT_AGGRO_PLAYER",
          "damage": 90.0,
          "damageSpec": "90",
          "penetration": 0.0,
          "penetrationSpec": "0",
          "breakDamage": 10.0,
          "breakDamageSpec": "10",
          "statusId": "NONE",
          "statusStacksSpec": "0",
          "statusDurationTicksSpec": "0",
          "effectOpcode": "LEAP_IMPACT",
          "effectParameters": "radius=1.4",
          "childEntityIds": [],
          "childEntitySource": "",
          "tags": [
            "MOBILITY",
            "MELEE"
          ],
          "responseTags": [
            "SIDE_MOVE",
            "DODGE",
            "PARRY"
          ]
        }
      ],
      "stateMachine": [
        "READY",
        "TELEGRAPH",
        "STARTUP",
        "ACTIVE",
        "RECOVERY"
      ],
      "raw": [
        "EN-D1-02",
        "측면 거미",
        "거미",
        "FLANKER·1",
        "240/15",
        "도약 90",
        "없음",
        "1"
      ]
    },
    {
      "id": "ACT-EN-D11-01",
      "sourceDocumentId": "ENEMY-ACTION-LIST-001",
      "enabled": true,
      "ownerId": "EN-D11-01",
      "kind": "ENEMY_ACTION_BUNDLE",
      "actions": [
        {
          "id": "ED20-WEAKEN-CLAW",
          "name": "ED20-WEAKEN-CLAW",
          "profileId": "EAP-CHASER",
          "telegraphTicks": 11,
          "startupTicks": 4,
          "activeTicks": 4,
          "recoveryTicks": 10,
          "cooldownTicks": 40,
          "cooldownMode": "TICKS",
          "cooldownTrigger": "",
          "range": 3.2,
          "targetPolicy": "NEAREST_ALIVE_PLAYER",
          "damage": 92.0,
          "damageSpec": "92",
          "penetration": 0.0,
          "penetrationSpec": "0",
          "breakDamage": 9.0,
          "breakDamageSpec": "9",
          "statusId": "WEAKNESS",
          "statusStacksSpec": "1",
          "statusDurationTicksSpec": "80",
          "effectOpcode": "MELEE_APPLY_STATUS",
          "effectParameters": "outgoingDamageDelta=-0.08",
          "childEntityIds": [],
          "childEntitySource": "",
          "tags": [
            "MELEE",
            "STATUS"
          ],
          "responseTags": [
            "DODGE",
            "GUARD",
            "PARRY",
            "DISTANCE"
          ]
        }
      ],
      "stateMachine": [
        "READY",
        "TELEGRAPH",
        "STARTUP",
        "ACTIVE",
        "RECOVERY"
      ],
      "raw": [
        "EN-D11-01",
        "쇠약 배회자",
        "좀비",
        "CHASER·1",
        "380/30",
        "할퀴기 92 + WEAKNESS",
        "없음",
        "11"
      ]
    },
    {
      "id": "ACT-EN-D11-02",
      "sourceDocumentId": "ENEMY-ACTION-LIST-001",
      "enabled": true,
      "ownerId": "EN-D11-02",
      "kind": "ENEMY_ACTION_BUNDLE",
      "actions": [
        {
          "id": "ED20-TOXIN-DART",
          "name": "ED20-TOXIN-DART",
          "profileId": "EAP-RANGED",
          "telegraphTicks": 14,
          "startupTicks": 4,
          "activeTicks": 4,
          "recoveryTicks": 10,
          "cooldownTicks": 60,
          "cooldownMode": "TICKS",
          "cooldownTrigger": "",
          "range": 16.0,
          "targetPolicy": "VISIBLE_ALIVE_PLAYER",
          "damage": 78.0,
          "damageSpec": "78",
          "penetration": 0.0,
          "penetrationSpec": "0",
          "breakDamage": 6.0,
          "breakDamageSpec": "6",
          "statusId": "POISON",
          "statusStacksSpec": "1",
          "statusDurationTicksSpec": "120",
          "effectOpcode": "PROJECTILE_APPLY_STATUS",
          "effectParameters": "",
          "childEntityIds": [],
          "childEntitySource": "",
          "tags": [
            "PROJECTILE",
            "STATUS"
          ],
          "responseTags": [
            "COVER",
            "DODGE",
            "GUARD",
            "PROJECTILE_CLEAR"
          ]
        }
      ],
      "stateMachine": [
        "READY",
        "TELEGRAPH",
        "STARTUP",
        "ACTIVE",
        "RECOVERY"
      ],
      "raw": [
        "EN-D11-02",
        "독침 사수",
        "보그드",
        "RANGED·2",
        "320/20",
        "독침 78 + POISON",
        "없음",
        "11"
      ]
    },
    {
      "id": "ACT-EN-D12-01",
      "sourceDocumentId": "ENEMY-ACTION-LIST-001",
      "enabled": true,
      "ownerId": "EN-D12-01",
      "kind": "ENEMY_ACTION_BUNDLE",
      "actions": [
        {
          "id": "ED20-THERMAL-CORE",
          "name": "ED20-THERMAL-CORE",
          "profileId": "EAP-ARTILLERY",
          "telegraphTicks": 20,
          "startupTicks": 4,
          "activeTicks": 4,
          "recoveryTicks": 10,
          "cooldownTicks": 100,
          "cooldownMode": "TICKS",
          "cooldownTrigger": "",
          "range": 16.0,
          "targetPolicy": "GROUND_AT_VISIBLE_PLAYER",
          "damage": 125.0,
          "damageSpec": "125",
          "penetration": 0.0,
          "penetrationSpec": "0",
          "breakDamage": 12.0,
          "breakDamageSpec": "12",
          "statusId": "BURN",
          "statusStacksSpec": "1",
          "statusDurationTicksSpec": "80",
          "effectOpcode": "DROP_AREA",
          "effectParameters": "areaTicks=80;radius=3;areaProfile=AREA-ENEMY-THERMAL",
          "childEntityIds": [],
          "childEntitySource": "",
          "tags": [
            "AREA",
            "STATUS",
            "INTERRUPTIBLE"
          ],
          "responseTags": [
            "LEAVE_AREA",
            "INTERRUPT",
            "COOLING"
          ]
        }
      ],
      "stateMachine": [
        "READY",
        "TELEGRAPH",
        "STARTUP",
        "ACTIVE",
        "RECOVERY"
      ],
      "raw": [
        "EN-D12-01",
        "잔불 포자체",
        "블레이즈",
        "ARTILLERY·4",
        "420/30",
        "열핵 125 + BURN 지대",
        "700",
        "12"
      ]
    },
    {
      "id": "ACT-EN-D12-02",
      "sourceDocumentId": "ENEMY-ACTION-LIST-001",
      "enabled": true,
      "ownerId": "EN-D12-02",
      "kind": "ENEMY_ACTION_BUNDLE",
      "actions": [
        {
          "id": "ED20-REVERSE-CARAPACE",
          "name": "ED20-REVERSE-CARAPACE",
          "profileId": "EAP-DEFENDER",
          "telegraphTicks": 10,
          "startupTicks": 4,
          "activeTicks": 1,
          "recoveryTicks": 10,
          "cooldownTicks": 80,
          "cooldownMode": "TICKS",
          "cooldownTrigger": "",
          "range": 0.0,
          "targetPolicy": "SELF",
          "damage": 0.0,
          "damageSpec": "0",
          "penetration": 0.0,
          "penetrationSpec": "0",
          "breakDamage": 0.0,
          "breakDamageSpec": "0",
          "statusId": "NONE",
          "statusStacksSpec": "0",
          "statusDurationTicksSpec": "0",
          "effectOpcode": "DIRECTIONAL_BREAK_MOD",
          "effectParameters": "front=0.80;rear=1.25;ticks=100",
          "childEntityIds": [],
          "childEntitySource": "",
          "tags": [
            "DEFENCE",
            "POSITIONAL"
          ],
          "responseTags": [
            "FLANK",
            "BAIT",
            "STATUS",
            "HOLD_ATTACK"
          ]
        }
      ],
      "stateMachine": [
        "READY",
        "TELEGRAPH",
        "STARTUP",
        "ACTIVE",
        "RECOVERY"
      ],
      "raw": [
        "EN-D12-02",
        "충격 갑피병",
        "허스크",
        "DEFENDER·4",
        "820/75",
        "방패 밀기 85, 갑피 강타 135",
        "1,100",
        "12"
      ]
    },
    {
      "id": "ACT-EN-D13-01",
      "sourceDocumentId": "ENEMY-ACTION-LIST-001",
      "enabled": true,
      "ownerId": "EN-D13-01",
      "kind": "ENEMY_ACTION_BUNDLE",
      "actions": [
        {
          "id": "ED20-HEMATIC-LEAP",
          "name": "ED20-HEMATIC-LEAP",
          "profileId": "EAP-FLANKER",